,project_title,link,code,status,start_date,description,description_processed,tokenized_description,bigram_descriptions
2,COMTA – COMpact modular Thermo Acoustic heat pump,https://ispt.eu/projects/comta/,UH-30-04,Ongoing,"November 1, 2018","To further develop the compact electrically driven thermoacoustic heat (TA) pump technology and to prepare for technical demonstration on full scale. 
 The industry is a large consumer of energy and about two-thirds of the industry’s energy use is represented by heat. Often high-temperature heat is required, this heat is currently provided by burning natural gas. In order for the industry to meet the climate goals we will need to move to low carbon heating systems. One way to achieve this is by implementing high temperature heat pumps. These heat pumps, however, are not yet commercially available. The COMTA project proposes to start using the electrically driven thermoacoustic heat pump for industrial purposes. It can deliver heat of up to 200°C and it can cover a very wide range of temperatures with a fixed standardized design. Because this heat pump is electrically driven, it will become completely carbon free once fully renewable electricity supplies have become a reality in the future.  
 About the COMTA project 
 The overall project objective is to further develop the compact electrically driven thermoacoustic heat (TA) pump technology and to prepare for technical demonstration on full scale. This is achieved by experimental demonstration of a high COP1 over a very wide temperature interval from 100 to over 200°C using waste heat between 50-150°C under simulated and onsite test conditions (at DOW Terneuzen utility). A single full scale modular design will be realized that can serve a wide market including (petro)chemical industry, refining, paper & food industry. By its modular design steam production can be matched to the process in the range of 1 to 10 MW by installing one up to 8 units on the piston compressor. Energy is saved and a carbon free heat supply can be realized utilizing renewable electricity. 
 The project is coordinated by  ECN.TNO . Other partners are  ISPT ,  DOW ,  Bronswerk Heat Transfer  and  Howden Compressors B.V.  
 Aimed Results 
 The COMTA proposal serves as a last stop before full scale demonstration projects are initiated. The remaining R&D work serves to improve efficiency concerns optimizing membrane and heat exchangers. This is addressed by means of experimental component testing within the existing COMTA test set-up. Integration at the DOW steam utility and the onsite testing will verify the technical feasibility under operational conditions. Realization of the full scale design will be used for the verification of the techno-economic feasibility and to prepare for the full scale testing in demo projects. This development results in net primary energy saving potential of 97 PJ per year and a CO 2  emission reduction of 4.5 million tons/year within the sectors food, paper & board bulk chemical and refineries in the Netherlands. Major fuel cost savings for Dutch industry amounting to 4.8 billion Euro can be realized. In the future renewable electricity system carbon free electricity would result in even higher CO 2  emission of 9.4 million tons/year. The worldwide market value for high temperature (steam) TA heat pump equipment and installation is estimated at 227 million euro per year during 20 years. 
 Status November 2020 
 Major developments in COMTA are the utilisation of an industrial piston compressor as driver and the strongly reduced dimensions of the pressure vessel (no resonator has been applied). Both developments will reduce future investment costs of the heat pump. 
 The COMTA heat pump set-up is commissioned in March 2020 and first successful tests series have been executed including recent tests with saturated steam delivery at 168 °C. The saturated steam is pumped from source heat delivered by an oil circuit at 94 °C. The compressor ran at 1055 rpm and a dynamic pressure amplitude of almost 2.9 bars is obtained with a static pressure of 29 bars. The internal COP in the thermoacoustic core amounts to 41% of the Carnot efficiency. This number however excludes a high temperature loss in the heat exchangers and mechanical losses in the compressor. 
 Outlook 
 The thermoacoustic heat pump part originates from a previous test setup (TASTE) and this part will be optimised for the COMTA conditions (lower drive frequency). A large increase of thermal output is expected by an increase of the working pressure, optimised heat exchangers and a new regenerator suitable for the lower frequency. In this case even higher steam delivery temperatures up to 200 °C will become feasible. Measurement of the mechanical power delivery by the piston will give insight in system losses and guidance for further improvements.",develop compact electrically driven thermoacoustic heat ta pump technology prepare technical demonstration full scale industry large consumer energy twothirds industry energy use represented heat often hightemperature heat required heat currently provided burning natural gas order industry meet climate goal need move low carbon heating system one way achieve implementing high temperature heat pump heat pump however yet commercially available comta project proposes start using electrically driven thermoacoustic heat pump industrial purpose deliver heat 200°c cover wide range temperature fixed standardized design heat pump electrically driven become completely carbon free fully renewable electricity supply become reality future comta project overall project objective develop compact electrically driven thermoacoustic heat ta pump technology prepare technical demonstration full scale achieved experimental demonstration high cop1 wide temperature interval 100 200°c using waste heat 50150°c simulated onsite test condition dow terneuzen utility single full scale modular design realized serve wide market including petrochemical industry refining paper food industry modular design steam production matched process range 1 10 mw installing one 8 unit piston compressor energy saved carbon free heat supply realized utilizing renewable electricity project coordinated ecntno partner ispt dow bronswerk heat transfer howden compressor bv aimed result comta proposal serf last stop full scale demonstration project initiated remaining rd work serf improve efficiency concern optimizing membrane heat exchanger addressed mean experimental component testing within existing comta test setup integration dow steam utility onsite testing verify technical feasibility operational condition realization full scale design used verification technoeconomic feasibility prepare full scale testing demo project development result net primary energy saving potential 97 pj per year co 2 emission reduction 45 million tonsyear within sector food paper board bulk chemical refinery netherlands major fuel cost saving dutch industry amounting 48 billion euro realized future renewable electricity system carbon free electricity would result even higher co 2 emission 94 million tonsyear worldwide market value high temperature steam ta heat pump equipment installation estimated 227 million euro per year 20 year status november 2020 major development comta utilisation industrial piston compressor driver strongly reduced dimension pressure vessel resonator applied development reduce future investment cost heat pump comta heat pump setup commissioned march 2020 first successful test series executed including recent test saturated steam delivery 168 °c saturated steam pumped source heat delivered oil circuit 94 °c compressor ran 1055 rpm dynamic pressure amplitude almost 29 bar obtained static pressure 29 bar internal cop thermoacoustic core amount 41 carnot efficiency number however excludes high temperature loss heat exchanger mechanical loss compressor outlook thermoacoustic heat pump part originates previous test setup taste part optimised comta condition lower drive frequency large increase thermal output expected increase working pressure optimised heat exchanger new regenerator suitable lower frequency case even higher steam delivery temperature 200 °c become feasible measurement mechanical power delivery piston give insight system loss guidance improvement,"['develop', 'compact', 'electrically', 'driven', 'thermoacoustic', 'heat', 'ta', 'pump', 'technology', 'prepare', 'technical', 'demonstration', 'full', 'scale', 'industry', 'large', 'consumer', 'energy', 'twothirds', 'industry', 'energy', 'use', 'represented', 'heat', 'often', 'hightemperature', 'heat', 'required', 'heat', 'currently', 'provided', 'burning', 'natural', 'gas', 'order', 'industry', 'meet', 'climate', 'goal', 'need', 'move', 'low', 'carbon', 'heating', 'system', 'one', 'way', 'achieve', 'implementing', 'high', 'temperature', 'heat', 'pump', 'heat', 'pump', 'however', 'yet', 'commercially', 'available', 'comta', 'project', 'proposes', 'start', 'using', 'electrically', 'driven', 'thermoacoustic', 'heat', 'pump', 'industrial', 'purpose', 'deliver', 'heat', '200°c', 'cover', 'wide', 'range', 'temperature', 'fixed', 'standardized', 'design', 'heat', 'pump', 'electrically', 'driven', 'become', 'completely', 'carbon', 'free', 'fully', 'renewable', 'electricity', 'supply', 'become', 'reality', 'future', 'comta', 'project', 'overall', 'project', 'objective', 'develop', 'compact', 'electrically', 'driven', 'thermoacoustic', 'heat', 'ta', 'pump', 'technology', 'prepare', 'technical', 'demonstration', 'full', 'scale', 'achieved', 'experimental', 'demonstration', 'high', 'cop1', 'wide', 'temperature', 'interval', '100', '200°c', 'using', 'waste', 'heat', '50150°c', 'simulated', 'onsite', 'test', 'condition', 'dow', 'terneuzen', 'utility', 'single', 'full', 'scale', 'modular', 'design', 'realized', 'serve', 'wide', 'market', 'including', 'petrochemical', 'industry', 'refining', 'paper', 'food', 'industry', 'modular', 'design', 'steam', 'production', 'matched', 'process', 'range', '1', '10', 'mw', 'installing', 'one', '8', 'unit', 'piston', 'compressor', 'energy', 'saved', 'carbon', 'free', 'heat', 'supply', 'realized', 'utilizing', 'renewable', 'electricity', 'project', 'coordinated', 'ecntno', 'partner', 'ispt', 'dow', 'bronswerk', 'heat', 'transfer', 'howden', 'compressor', 'bv', 'aimed', 'result', 'comta', 'proposal', 'serf', 'last', 'stop', 'full', 'scale', 'demonstration', 'project', 'initiated', 'remaining', 'rd', 'work', 'serf', 'improve', 'efficiency', 'concern', 'optimizing', 'membrane', 'heat', 'exchanger', 'addressed', 'mean', 'experimental', 'component', 'testing', 'within', 'existing', 'comta', 'test', 'setup', 'integration', 'dow', 'steam', 'utility', 'onsite', 'testing', 'verify', 'technical', 'feasibility', 'operational', 'condition', 'realization', 'full', 'scale', 'design', 'used', 'verification', 'technoeconomic', 'feasibility', 'prepare', 'full', 'scale', 'testing', 'demo', 'project', 'development', 'result', 'net', 'primary', 'energy', 'saving', 'potential', '97', 'pj', 'per', 'year', 'co', '2', 'emission', 'reduction', '45', 'million', 'tonsyear', 'within', 'sector', 'food', 'paper', 'board', 'bulk', 'chemical', 'refinery', 'netherlands', 'major', 'fuel', 'cost', 'saving', 'dutch', 'industry', 'amounting', '48', 'billion', 'euro', 'realized', 'future', 'renewable', 'electricity', 'system', 'carbon', 'free', 'electricity', 'would', 'result', 'even', 'higher', 'co', '2', 'emission', '94', 'million', 'tonsyear', 'worldwide', 'market', 'value', 'high', 'temperature', 'steam', 'ta', 'heat', 'pump', 'equipment', 'installation', 'estimated', '227', 'million', 'euro', 'per', 'year', '20', 'year', 'status', 'november', '2020', 'major', 'development', 'comta', 'utilisation', 'industrial', 'piston', 'compressor', 'driver', 'strongly', 'reduced', 'dimension', 'pressure', 'vessel', 'resonator', 'applied', 'development', 'reduce', 'future', 'investment', 'cost', 'heat', 'pump', 'comta', 'heat', 'pump', 'setup', 'commissioned', 'march', '2020', 'first', 'successful', 'test', 'series', 'executed', 'including', 'recent', 'test', 'saturated', 'steam', 'delivery', '168', '°c', 'saturated', 'steam', 'pumped', 'source', 'heat', 'delivered', 'oil', 'circuit', '94', '°c', 'compressor', 'ran', '1055', 'rpm', 'dynamic', 'pressure', 'amplitude', 'almost', '29', 'bar', 'obtained', 'static', 'pressure', '29', 'bar', 'internal', 'cop', 'thermoacoustic', 'core', 'amount', '41', 'carnot', 'efficiency', 'number', 'however', 'excludes', 'high', 'temperature', 'loss', 'heat', 'exchanger', 'mechanical', 'loss', 'compressor', 'outlook', 'thermoacoustic', 'heat', 'pump', 'part', 'originates', 'previous', 'test', 'setup', 'taste', 'part', 'optimised', 'comta', 'condition', 'lower', 'drive', 'frequency', 'large', 'increase', 'thermal', 'output', 'expected', 'increase', 'working', 'pressure', 'optimised', 'heat', 'exchanger', 'new', 'regenerator', 'suitable', 'lower', 'frequency', 'case', 'even', 'higher', 'steam', 'delivery', 'temperature', '200', '°c', 'become', 'feasible', 'measurement', 'mechanical', 'power', 'delivery', 'piston', 'give', 'insight', 'system', 'loss', 'guidance', 'improvement']","['develop', 'compact', 'electrically', 'driven', 'thermoacoustic', 'heat', 'ta', 'pump', 'technology', 'prepare', 'technical', 'demonstration', 'full', 'scale', 'industry', 'large', 'consumer', 'energy', 'twothirds', 'industry', 'energy', 'use', 'represented', 'heat', 'often', 'hightemperature', 'heat', 'required', 'heat', 'currently', 'provided', 'burning', 'natural', 'gas', 'order', 'industry', 'meet', 'climate', 'goal', 'need', 'move', 'low', 'carbon', 'heating', 'system', 'one', 'way', 'achieve', 'implementing', 'high', 'temperature', 'heat', 'pump', 'heat', 'pump', 'however', 'yet', 'commercially', 'available', 'comta', 'project', 'proposes', 'start', 'using', 'electrically', 'driven', 'thermoacoustic', 'heat', 'pump', 'industrial', 'purpose', 'deliver', 'heat', '200°c', 'cover', 'wide', 'range', 'temperature', 'fixed', 'standardized', 'design', 'heat', 'pump', 'electrically', 'driven', 'become', 'completely', 'carbon', 'free', 'fully', 'renewable', 'electricity', 'supply', 'become', 'reality', 'future', 'comta', 'project', 'overall', 'project', 'objective', 'develop', 'compact', 'electrically', 'driven', 'thermoacoustic', 'heat', 'ta', 'pump', 'technology', 'prepare', 'technical', 'demonstration', 'full', 'scale', 'achieved', 'experimental', 'demonstration', 'high', 'cop1', 'wide', 'temperature', 'interval', '100', '200°c', 'using', 'waste', 'heat', '50150°c', 'simulated', 'onsite', 'test', 'condition', 'dow', 'terneuzen', 'utility', 'single', 'full', 'scale', 'modular', 'design', 'realized', 'serve', 'wide', 'market', 'including', 'petrochemical', 'industry', 'refining', 'paper', 'food', 'industry', 'modular', 'design', 'steam', 'production', 'matched', 'process', 'range', '1', '10', 'mw', 'installing', 'one', '8', 'unit', 'piston', 'compressor', 'energy', 'saved', 'carbon', 'free', 'heat', 'supply', 'realized', 'utilizing', 'renewable', 'electricity', 'project', 'coordinated', 'ecntno', 'partner', 'ispt', 'dow', 'bronswerk', 'heat', 'transfer', 'howden', 'compressor', 'bv', 'aimed', 'result', 'comta', 'proposal', 'serf', 'last', 'stop', 'full', 'scale', 'demonstration', 'project', 'initiated', 'remaining', 'rd', 'work', 'serf', 'improve', 'efficiency', 'concern', 'optimizing', 'membrane', 'heat', 'exchanger', 'addressed', 'mean', 'experimental', 'component', 'testing', 'within', 'existing', 'comta', 'test', 'setup', 'integration', 'dow', 'steam', 'utility', 'onsite', 'testing', 'verify', 'technical', 'feasibility', 'operational', 'condition', 'realization', 'full', 'scale', 'design', 'used', 'verification', 'technoeconomic', 'feasibility', 'prepare', 'full', 'scale', 'testing', 'demo', 'project', 'development', 'result', 'net', 'primary', 'energy', 'saving', 'potential', '97', 'pj', 'per', 'year', 'co', '2', 'emission', 'reduction', '45', 'million', 'tonsyear', 'within', 'sector', 'food', 'paper', 'board', 'bulk', 'chemical', 'refinery', 'netherlands', 'major', 'fuel', 'cost', 'saving', 'dutch', 'industry', 'amounting', '48', 'billion', 'euro', 'realized', 'future', 'renewable', 'electricity', 'system', 'carbon', 'free', 'electricity', 'would', 'result', 'even', 'higher', 'co', '2', 'emission', '94', 'million', 'tonsyear', 'worldwide', 'market', 'value', 'high', 'temperature', 'steam', 'ta', 'heat', 'pump', 'equipment', 'installation', 'estimated', '227', 'million', 'euro', 'per', 'year', '20', 'year', 'status', 'november', '2020', 'major', 'development', 'comta', 'utilisation', 'industrial', 'piston', 'compressor', 'driver', 'strongly', 'reduced', 'dimension', 'pressure', 'vessel', 'resonator', 'applied', 'development', 'reduce', 'future', 'investment', 'cost', 'heat', 'pump', 'comta', 'heat', 'pump', 'setup', 'commissioned', 'march', '2020', 'first', 'successful', 'test', 'series', 'executed', 'including', 'recent', 'test', 'saturated', 'steam', 'delivery', '168', '°c', 'saturated', 'steam', 'pumped', 'source', 'heat', 'delivered', 'oil', 'circuit', '94', '°c', 'compressor', 'ran', '1055', 'rpm', 'dynamic', 'pressure', 'amplitude', 'almost', '29', 'bar', 'obtained', 'static', 'pressure', '29', 'bar', 'internal', 'cop', 'thermoacoustic', 'core', 'amount', '41', 'carnot', 'efficiency', 'number', 'however', 'excludes', 'high', 'temperature', 'loss', 'heat', 'exchanger', 'mechanical', 'loss', 'compressor', 'outlook', 'thermoacoustic', 'heat', 'pump', 'part', 'originates', 'previous', 'test', 'setup', 'taste', 'part', 'optimised', 'comta', 'condition', 'lower', 'drive', 'frequency', 'large', 'increase', 'thermal', 'output', 'expected', 'increase', 'working', 'pressure', 'optimised', 'heat', 'exchanger', 'new', 'regenerator', 'suitable', 'lower', 'frequency', 'case', 'even', 'higher', 'steam', 'delivery', 'temperature', '200', '°c', 'become', 'feasible', 'measurement', 'mechanical', 'power', 'delivery', 'piston', 'give', 'insight', 'system', 'loss', 'guidance', 'improvement', 'heat_pump', 'heat_pump', 'heat_pump', 'heat_pump', 'heat_pump', 'heat_pump', 'heat_pump', 'heat_pump']"
