,project_title,link,code,status,start_date,description,description_processed,tokenized_description,bigram_descriptions
9,Steam and condensate quality,https://ispt.eu/projects/condensate-quality/,WP-20-11,Completed,"January 1, 2017","This project focuses on requiering better insights into the distribution and behaviour of conditioning chemicals that is used in their steam-water cycles and condensate polishing.   
 Process industries strive for more efficient use of water, saving energy and reducing thermal load of effluent discharged on surface water. This requires better insights into the distribution and behaviour of conditioning chemicals (and their breakdown products) used in their steam-water cycles and condensate polishing.  
 Project goals 
 The project aims are threefold: 
 Increased insight in the fate of conditioning chemicals (and the resulting protection) in stream-water cycles. Improved steam conditioning and condensate polishing and treatment, so that more condensate can be returned. Improved knowledge on harmful effects of different organic carbon (TOC) components, in relation to boiler feed guidelines.  
 Technical work packages 
 The project has three specific technical work packages. The first work package aims to elucidate the fate of boiler feed water conditioning chemicals after going through the steam cycle, including formation of breakdown products, distribution over the system and corresponding long-term impact on the metallurgy in the system. 
 The second work package aims at improved options of treating “off-spec” condensates, as well as heavily impaired process condensates, to increase water usage efficiency in the plant.  
 The third work package links the insights of the first work packages to corrosion measurements. This to improve insight in required boiler feed water treatment (especially with respect to TOC removal) and conditioning for improved protection of the plant. The scope includes filming and neutralizing amines and circuits operating at elevated temperature/ pressure (350-550 °C, 30-130 bar). 
 Expected results 
 This project results in a better description and modelling of the behavior, distribution and effect (in combination with proper monitoring) of different amines and organic pollutants, as well as their respective breakdown products in steam/ condensate circuits at elevated temperatures. 
 The project also delivers improved treatment options for “off-spec” and heavily impaired condensates, and will develop a robust Condensate Quality Assurance system.",project focus requiering better insight distribution behaviour conditioning chemical used steamwater cycle condensate polishing process industry strive efficient use water saving energy reducing thermal load effluent discharged surface water requires better insight distribution behaviour conditioning chemical breakdown product used steamwater cycle condensate polishing project goal project aim threefold increased insight fate conditioning chemical resulting protection streamwater cycle improved steam conditioning condensate polishing treatment condensate returned improved knowledge harmful effect different organic carbon toc component relation boiler feed guideline technical work package project three specific technical work package first work package aim elucidate fate boiler feed water conditioning chemical going steam cycle including formation breakdown product distribution system corresponding longterm impact metallurgy system second work package aim improved option treating offspec condensate well heavily impaired process condensate increase water usage efficiency plant third work package link insight first work package corrosion measurement improve insight required boiler feed water treatment especially respect toc removal conditioning improved protection plant scope includes filming neutralizing amine circuit operating elevated temperature pressure 350550 °c 30130 bar expected result project result better description modelling behavior distribution effect combination proper monitoring different amine organic pollutant well respective breakdown product steam condensate circuit elevated temperature project also delivers improved treatment option offspec heavily impaired condensate develop robust condensate quality assurance system,"['project', 'focus', 'requiering', 'better', 'insight', 'distribution', 'behaviour', 'conditioning', 'chemical', 'used', 'steamwater', 'cycle', 'condensate', 'polishing', 'process', 'industry', 'strive', 'efficient', 'use', 'water', 'saving', 'energy', 'reducing', 'thermal', 'load', 'effluent', 'discharged', 'surface', 'water', 'requires', 'better', 'insight', 'distribution', 'behaviour', 'conditioning', 'chemical', 'breakdown', 'product', 'used', 'steamwater', 'cycle', 'condensate', 'polishing', 'project', 'goal', 'project', 'aim', 'threefold', 'increased', 'insight', 'fate', 'conditioning', 'chemical', 'resulting', 'protection', 'streamwater', 'cycle', 'improved', 'steam', 'conditioning', 'condensate', 'polishing', 'treatment', 'condensate', 'returned', 'improved', 'knowledge', 'harmful', 'effect', 'different', 'organic', 'carbon', 'toc', 'component', 'relation', 'boiler', 'feed', 'guideline', 'technical', 'work', 'package', 'project', 'three', 'specific', 'technical', 'work', 'package', 'first', 'work', 'package', 'aim', 'elucidate', 'fate', 'boiler', 'feed', 'water', 'conditioning', 'chemical', 'going', 'steam', 'cycle', 'including', 'formation', 'breakdown', 'product', 'distribution', 'system', 'corresponding', 'longterm', 'impact', 'metallurgy', 'system', 'second', 'work', 'package', 'aim', 'improved', 'option', 'treating', 'offspec', 'condensate', 'well', 'heavily', 'impaired', 'process', 'condensate', 'increase', 'water', 'usage', 'efficiency', 'plant', 'third', 'work', 'package', 'link', 'insight', 'first', 'work', 'package', 'corrosion', 'measurement', 'improve', 'insight', 'required', 'boiler', 'feed', 'water', 'treatment', 'especially', 'respect', 'toc', 'removal', 'conditioning', 'improved', 'protection', 'plant', 'scope', 'includes', 'filming', 'neutralizing', 'amine', 'circuit', 'operating', 'elevated', 'temperature', 'pressure', '350550', '°c', '30130', 'bar', 'expected', 'result', 'project', 'result', 'better', 'description', 'modelling', 'behavior', 'distribution', 'effect', 'combination', 'proper', 'monitoring', 'different', 'amine', 'organic', 'pollutant', 'well', 'respective', 'breakdown', 'product', 'steam', 'condensate', 'circuit', 'elevated', 'temperature', 'project', 'also', 'delivers', 'improved', 'treatment', 'option', 'offspec', 'heavily', 'impaired', 'condensate', 'develop', 'robust', 'condensate', 'quality', 'assurance', 'system']","['project', 'focus', 'requiering', 'better', 'insight', 'distribution', 'behaviour', 'conditioning', 'chemical', 'used', 'steamwater', 'cycle', 'condensate', 'polishing', 'process', 'industry', 'strive', 'efficient', 'use', 'water', 'saving', 'energy', 'reducing', 'thermal', 'load', 'effluent', 'discharged', 'surface', 'water', 'requires', 'better', 'insight', 'distribution', 'behaviour', 'conditioning', 'chemical', 'breakdown', 'product', 'used', 'steamwater', 'cycle', 'condensate', 'polishing', 'project', 'goal', 'project', 'aim', 'threefold', 'increased', 'insight', 'fate', 'conditioning', 'chemical', 'resulting', 'protection', 'streamwater', 'cycle', 'improved', 'steam', 'conditioning', 'condensate', 'polishing', 'treatment', 'condensate', 'returned', 'improved', 'knowledge', 'harmful', 'effect', 'different', 'organic', 'carbon', 'toc', 'component', 'relation', 'boiler', 'feed', 'guideline', 'technical', 'work', 'package', 'project', 'three', 'specific', 'technical', 'work', 'package', 'first', 'work', 'package', 'aim', 'elucidate', 'fate', 'boiler', 'feed', 'water', 'conditioning', 'chemical', 'going', 'steam', 'cycle', 'including', 'formation', 'breakdown', 'product', 'distribution', 'system', 'corresponding', 'longterm', 'impact', 'metallurgy', 'system', 'second', 'work', 'package', 'aim', 'improved', 'option', 'treating', 'offspec', 'condensate', 'well', 'heavily', 'impaired', 'process', 'condensate', 'increase', 'water', 'usage', 'efficiency', 'plant', 'third', 'work', 'package', 'link', 'insight', 'first', 'work', 'package', 'corrosion', 'measurement', 'improve', 'insight', 'required', 'boiler', 'feed', 'water', 'treatment', 'especially', 'respect', 'toc', 'removal', 'conditioning', 'improved', 'protection', 'plant', 'scope', 'includes', 'filming', 'neutralizing', 'amine', 'circuit', 'operating', 'elevated', 'temperature', 'pressure', '350550', '°c', '30130', 'bar', 'expected', 'result', 'project', 'result', 'better', 'description', 'modelling', 'behavior', 'distribution', 'effect', 'combination', 'proper', 'monitoring', 'different', 'amine', 'organic', 'pollutant', 'well', 'respective', 'breakdown', 'product', 'steam', 'condensate', 'circuit', 'elevated', 'temperature', 'project', 'also', 'delivers', 'improved', 'treatment', 'option', 'offspec', 'heavily', 'impaired', 'condensate', 'develop', 'robust', 'condensate', 'quality', 'assurance', 'system']"
10,ENCORE – nExt geNeration COmpRession hEat pump,https://ispt.eu/projects/encore/,UH-30-03,Ongoing,"January 1, 2019","The ENCORE project, aims to significantly increase the uptake of heat pumps in the industry. To achieve this, the project will demonstrate enhancement of compression heat pump performance by using a pilot scale test unit.  
 In short: 
 
 A demonstrated enhancement of compression heat pump performance 
 Results of the pilot scale test unit 
 A look into wider market introduction 
 
 About ENCORE 
  The project consists of different parts that will altogether yield a series of technological improvements for high temperature compression heat pumps. The project results will describe the impact of various changes made to a regular compression heat pump. They will also provide insights for companies into the benefits and possible challenges when applying these heat pumps in their processes. All of these results will allow the high temperature compression heat pump to make the next step towards a wider market introduction.  
 The consortium consists of ECN.TNO as the coordinator and the partners:   Recoy , ISPT,  Bronswerk Heat Transfer ,  Tata Steel ,  DOW ,  SmurfitKappa ,  DSM  and LWM. 
 Results 
 The results will consist of:  
 
 Technological improvements for high temperature compression heat pumps (ex. new working media, innovative cycles and components and dynamic control) 
 Reports will be delivered describing the impact of various changes to the regular heat pump and insight for companies regarding the feasibility and challenges of applying high temperature compression heat pumps.  
 
 
 More on our  Heat Integration Platform",encore project aim significantly increase uptake heat pump industry achieve project demonstrate enhancement compression heat pump performance using pilot scale test unit short demonstrated enhancement compression heat pump performance result pilot scale test unit look wider market introduction encore project consists different part altogether yield series technological improvement high temperature compression heat pump project result describe impact various change made regular compression heat pump also provide insight company benefit possible challenge applying heat pump process result allow high temperature compression heat pump make next step towards wider market introduction consortium consists ecntno coordinator partner recoy ispt bronswerk heat transfer tata steel dow smurfitkappa dsm lwm result result consist technological improvement high temperature compression heat pump ex new working medium innovative cycle component dynamic control report delivered describing impact various change regular heat pump insight company regarding feasibility challenge applying high temperature compression heat pump heat integration platform,"['encore', 'project', 'aim', 'significantly', 'increase', 'uptake', 'heat', 'pump', 'industry', 'achieve', 'project', 'demonstrate', 'enhancement', 'compression', 'heat', 'pump', 'performance', 'using', 'pilot', 'scale', 'test', 'unit', 'short', 'demonstrated', 'enhancement', 'compression', 'heat', 'pump', 'performance', 'result', 'pilot', 'scale', 'test', 'unit', 'look', 'wider', 'market', 'introduction', 'encore', 'project', 'consists', 'different', 'part', 'altogether', 'yield', 'series', 'technological', 'improvement', 'high', 'temperature', 'compression', 'heat', 'pump', 'project', 'result', 'describe', 'impact', 'various', 'change', 'made', 'regular', 'compression', 'heat', 'pump', 'also', 'provide', 'insight', 'company', 'benefit', 'possible', 'challenge', 'applying', 'heat', 'pump', 'process', 'result', 'allow', 'high', 'temperature', 'compression', 'heat', 'pump', 'make', 'next', 'step', 'towards', 'wider', 'market', 'introduction', 'consortium', 'consists', 'ecntno', 'coordinator', 'partner', 'recoy', 'ispt', 'bronswerk', 'heat', 'transfer', 'tata', 'steel', 'dow', 'smurfitkappa', 'dsm', 'lwm', 'result', 'result', 'consist', 'technological', 'improvement', 'high', 'temperature', 'compression', 'heat', 'pump', 'ex', 'new', 'working', 'medium', 'innovative', 'cycle', 'component', 'dynamic', 'control', 'report', 'delivered', 'describing', 'impact', 'various', 'change', 'regular', 'heat', 'pump', 'insight', 'company', 'regarding', 'feasibility', 'challenge', 'applying', 'high', 'temperature', 'compression', 'heat', 'pump', 'heat', 'integration', 'platform']","['encore', 'project', 'aim', 'significantly', 'increase', 'uptake', 'heat', 'pump', 'industry', 'achieve', 'project', 'demonstrate', 'enhancement', 'compression', 'heat', 'pump', 'performance', 'using', 'pilot', 'scale', 'test', 'unit', 'short', 'demonstrated', 'enhancement', 'compression', 'heat', 'pump', 'performance', 'result', 'pilot', 'scale', 'test', 'unit', 'look', 'wider', 'market', 'introduction', 'encore', 'project', 'consists', 'different', 'part', 'altogether', 'yield', 'series', 'technological', 'improvement', 'high', 'temperature', 'compression', 'heat', 'pump', 'project', 'result', 'describe', 'impact', 'various', 'change', 'made', 'regular', 'compression', 'heat', 'pump', 'also', 'provide', 'insight', 'company', 'benefit', 'possible', 'challenge', 'applying', 'heat', 'pump', 'process', 'result', 'allow', 'high', 'temperature', 'compression', 'heat', 'pump', 'make', 'next', 'step', 'towards', 'wider', 'market', 'introduction', 'consortium', 'consists', 'ecntno', 'coordinator', 'partner', 'recoy', 'ispt', 'bronswerk', 'heat', 'transfer', 'tata', 'steel', 'dow', 'smurfitkappa', 'dsm', 'lwm', 'result', 'result', 'consist', 'technological', 'improvement', 'high', 'temperature', 'compression', 'heat', 'pump', 'ex', 'new', 'working', 'medium', 'innovative', 'cycle', 'component', 'dynamic', 'control', 'report', 'delivered', 'describing', 'impact', 'various', 'change', 'regular', 'heat', 'pump', 'insight', 'company', 'regarding', 'feasibility', 'challenge', 'applying', 'high', 'temperature', 'compression', 'heat', 'pump', 'heat', 'integration', 'platform', 'heat_pump', 'heat_pump', 'heat_pump', 'heat_pump', 'heat_pump', 'heat_pump', 'heat_pump', 'heat_pump', 'heat_pump', 'heat_pump']"
